{
  "schema": "sentinel-inspection-page/draft-1",
  "viewId": "view-example",
  "sequence": 1,
  "collection": "works",
  "rows": [
    {
      "kind": "work",
      "workKey": "h11111111111111111111111111111111",
      "stage": "capture",
      "revision": 1,
      "prerequisites": [],
      "disposition": "planned",
      "recordedWork": null,
      "inputCount": 0,
      "implementationKey": "h11111111111111111111111111111111"
    }
  ],
  "nextCursor": null
}
